{"schema_version": 1, "field_id": "airflow_box_cfd", "source": "openfoam:simpleFoam v2412", "time_s": 0.0, "grid": {"origin": {"x": 0.0, "y": 0.0, "z": 0.0}, "cell_size": {"x": 0.5, "y": 0.49230769230769234, "z": 0.5}, "cells": {"x": 24, "y": 13, "z": 6}}, "channels": [{"quantity": "velocity", "unit": "m/s", "components": 3, "encoding": "float32-le-base64", "data": "u4aCu2sEmDu/3Sm6F0hbvGf+WjtRnB65lQikvEuyzzqdH+A6SmbPvAkZhzhafmQ78sXtvJnKyrrobJs7OOz4vMhuRLuYdag7iwLsvJKveLsEi5M7prbEvNJRfbu2SFI7ZgBovNyIgrvXB9k6CaD/O084sruOxiC7U1P2PPj8Tjst8w28XgcmPQNRITyEa1C8Of8jPRxxRTxdtFi8Et8OPYLdOjxIdzm8Xu/uPMbKGTxfQw+8bI3HPFn24zsCQNK7y7CqPLeYnjvjSZe7isiWPOHYXzsZQmC7Fb6HPMcuNTtZYjq76ORxPDavODuxgTu7299NPCt0Xzs4nGK7r2QgPBiSjztSUZW7BJz1O3fFpTtzxce70TL4OusszjucZaO7WkzPu4Nrozyh0XC6zzCQvDNLSjwvrfA5s62RvDTy8TlIuI871rh2vN5hGbz+NAI8nERJvD6klLyBWC884M0hvGzfz7xFEEU8Ec/iu+Up+Ly3ATs8+gfmuogZCr2y9Rg85i0aPB/EI72qVOE7jK0rPZfkS73kVRY6INiLPSzVebwUMZW7QY+bPbjicjyhvQ+8hLSRPSeX6Tz3Lyi8HF2APdA6Az08TRu8URdiPZSl+DwnfAa8TvlLPQp+1jyB3Ou7/AE+PbgmsDy2idG7lbg1PSOGkTwW7b27F7YvPS/4gTyyc7a7sBwoPc5LhTzFMsK7DkUbPS06nDxnyOu721sEPaX8xTw13x28Q8rTPL839jyAWWK82AjtO/7cDj2jXzq8T7v4u/lEIz1NHau7Z/AzOyt3Kjw1cLi6sUXqPDnRpby3Dq474mNDPU25GL2sbzo8NoZiPaRNR7300YU8wQpaPds2ar1bcZw8Wi06PVWcgr1EVJg87KcYPdp7kr0WanQ8kj0jPdVlub19J9Y7kwSTPXTY7r0Y+sK7/Bi5PW6bPb2/8vU60XSaPZBxITzZV3U793VzPf2RDj0Fcvg6KRFNPVSuLj3aY6k55+I6PZrgLT3hdJi6nYA5PeQQHj2o9TO7xF5EPdF7Cz2BeYW7l61VPRLp+jyToKS7NFBoPQDu8jzIlb+7H6h3PelKBD0s6uO7eK1/PeEhIj1O/RO8vtJ2PVkkWD1Vf1G8kixmPTAYjz33nqW8ohWuPIgLtz1iL5S8Ney0PdJEx7yLrFa77BcQPi6oSL1x2JQ6K1MtPoHZd71Mfwc8uDg1PjC/h71hFn08NVkoPirYj71if6w8rioMPn3Zlr23J8I8jxDPPUL3n70w67I8QpmDPVZGtr37DF88+1A/PVfa+L11Vw+8wZuIPahiJr7QcgG94CqPPdk9X70OmXw7haXEPC2UDjxe1kM8kQl0PNFI7DzmhR88PBiIPFvBEj3U1OU7eguiPEgyGz1ZdHM77dHWPD3+GD0GpAE6+E4TPT2rEj0NJQO7i5RDPTKTDz1Seny7QgR4PRW/Fj00fa+7ApaWPdlcMD1X7uO7ztqwPXgVaD1S0xy8pQbCPQoTqT0rj2W81nnePXvtBT6xM928GlQMPeklSj4qxOS8DkXzPg7VobzGypI7Md3aPlfPKb2e3TE8/BPCPoStSb0vwoA867mmPo9ZV70Yy6M8mjSIPhFPYb205L08YjdOPgzmar3PEMQ8SKUJPjS4e70Ng6M8ArGKPWUmlr0oQMc7T0G8PDuT171TbPy8vy44PKmBAL7Kgn29AAAAAAAAAAAAAAAAAAAAAAAAAAAAAAAAOjHfukPQCjxTd/o7w0aVu9pakjzPUcs7NR/lufbZvzwLCmk73L4OPNIA2TyqsIc6g6W1PC615jyjtJC6fRYgPaQE9jxPLj67GddxPbb/Cj08rZK719uoPZ17LD1Pr8i78R7kPYencD0EZgq8DqYXPhWBtD3FE0C8ntpXPhUgFz6/Caa8k1mZPp49hD5Sc/q8DPL1PgnJILwwkhE8c+3iPp83lbxI8J88hw3KPvV6o7xXtsY8/2mrPkksr7whwNc848SJPuqpwbyk89s8T7VMPhos17xBL84829YDPgcO9rxh1Zs8HydmPWJaHL24CRI7eughPJigYL2wahe9+UcLO4jwd70K2Ya9AAAAAAAAAAAAAAAAAAAAAAAAAAAAAAAAlTqtu8qWrTpDOsk7Zv9MvKi+xzu6fZY7tZQuvL9EKTxPbjE7vawKuwBfWTyVBXY6KIlEPOMyezxoGUS6I4r+PLK5jjxOdBK7m/9hPcbRqTxXfWq7m9awPTwA2jyXmKi7dgwBPq5iHT1Eud27w3hEPn0dZz178C28rFmBPplsvD1IxT+8FC7tPgt5Kj43mua8zjL2PrAWCDLyZyM8sevjPgyeWzIpuq88sq/KPsrlqDIr7tM8akCrPpoY9jKx+t48pzSJPsBECjNdX908Y1hLPgJ2/DI7Hcs8WuYBPrtXxzLtKJU8QGdXPaH9bjLCKmU6O6rYO0lZITJIGR+9crDMOee1jjInKIe9AAAAAAAAAAAAAAAAAAAAAAAAAAAAAAAAdHC2u8+oV7LzC7w7RvBqvFOZ8LLAe4k7OrZgvIVEAbMSHiM7G4TAuxlIDLMI02o6z0QEPOHGRrO3nS66hbvhPAeCVbORlQS7qRJYPRfUIbOMw1O7lRuxPcHd4LK7tJy7Ll0DPgS4Q7PK1cW7wkpSPur+cbPcAi68xl+CPvUjmbPDmRW8Cr4BP1XJKbQpKtG8DPL1PhzJIDwukhE8c+3iPrE3lTxG8J88hw3KPhJ7ozxWtsY8/mmrPm0srzwmwNc84sSJPhGqwTyt89s8TbVMPj0s1zxCL8482NYDPiAO9jxb1Zs8EydmPWlaHD3HCRI7YeghPJqgYD2zahe9wkcLO5Dwdz0J2Ya9AAAAAAAAAAAAAAAAAAAAAAAAAAAAAAAAmTqtu9KXrbpCOsk7YP9MvCe/x7ujfZY7oZQuvP9EKbwwbjE7lawKu0JfWbwbBXY6L4lEPEEze7wwG0S6L4r+POe5jryqdBK7of9hPfXRqbzkfGq7mtawPWUA2rwXmKi7dQwBPsdiHb3luN27wXhEPp8dZ72J8C28q1mBPq9svL2zxT+8Ey7tPhx5Kr50mua8DkXzPhfVoTzFypI7Md3aPmDPKT2d3TE8/BPCPpWtST0uwoA867mmPqRZVz0ey6M8mTSIPihPYT285L08YDdOPiLmaj3NEMQ8RaUJPkO4ez0Hg6M8+bCKPWgmlj0pQMc7T0G8PD6T1z1hbPy8wC44PKmBAD67gn29AAAAAAAAAAAAAAAAAAAAAAAAAAAAAAAAlTHfuk/QCrwwd/o7t0aVu/FakrzIUcs7aBvluQ/av7w4Cmk77L4OPPAA2bySsIc6haW1PFq15rxwtpC6hBYgPd0E9rxXLz67I9dxPdX/Cr0crZK719uoPbx7LL2Nrsi78B7kPaWncL26ZQq8DKYXPimBtL3CE0C8mtpXPiAgF77+Caa8kFmZPqI9hL6sc/q8N+y0PdpExzx+rFa77xcQPjioSD1o2JQ6MVMtPpXZdz1Ifwc8vzg1Pj2/hz1wFn08O1koPjnYjz1sf6w8sioMPozZlj2+J8I8kBDPPU73nz0w67I8P5mDPV1Gtj0CDV88/FA/PVza+D11Vw+8wJuIPapiJj69cgG93iqPPdQ9Xz3WmXw7b6XEPEeUDrx31kM8Ygl0PNlI7LzshR88MRiIPGPBEr3V1OU7gQuiPFMyG72kdHM78dHWPE7+GL0upQE6+E4TPVOrEr3LJQO7kpRDPU2TD722e3y7UAR4PTO/Fr1Xfa+7BpaWPftcML207eO7ztqwPZkVaL0T0xy8ogbCPRsTqb05j2W8znnePYDtBb77M928B1QMPewlSr6MxOS8Ubv4u/tEI71lHau7rvAzOx93KrxvcLi6zkXqPFrRpTzPDq47+2NDPWu5GD3Jbzo8VIZiPcpNRz0M0oU82ApaPQE3aj10cZw8Zi06PWWcgj1UVJg88KcYPeZ7kj0qanQ8kT0jPdhluT0PKNY7kwSTPXXY7j3K+cK7+Ri5PWCbPT3z8/U6zXSaPedxIbypWHU77nVzPRKSDr0BdPg6JBFNPWOuLr3sZ6k55+I6PavgLb2EdJi6noA5PfsQHr2m9TO7xl5EPeh7C73WeYW7oa1VPT3p+rwaoaS7Q1BoPTDu8rzllb+7Kqh3PQVLBL3D6eO7eq1/PfshIr0n/RO8ttJ2PWskWL17f1G8gSxmPTMYj70zn6W8hRWuPIQLt72rL5S8V0zPu4Vro7z+0XC60jCQvDBLSrw9rvA5uq2RvHnv8bl6uI8727h2vBtiGTwrNQI8mURJvG2klDy/WC884s0hvKLfzzx7EEU8JM/iuxUq+DzRATs8rQjmupoZCj2b9Rg81i0aPB/EIz14VOE7i60rPYnkSz2SUxY6IdiLPdTUeTxuMZW7RY+bPRLjcrzGvQ+8i7SRPVGX6bz6Lyi8IF2APeI6A70TTRu8UhdiPbil+LwNfAa8UPlLPTF+1rzB3Ou7BQI+PdgmsLw+itG7obg1PTuGkbxw7b27IrYvPUn4gbysc7a7txwoPe1LhbyWMsK7DUUbPUo6nLxPyOu7zVsEPbL8xbxF3x28FcrTPLU39rzAWWK8YwjtO/DcDr33Xzq8wYaCu2wEmLsO3im6KUhbvHb+WrsHnR65rAikvHiyz7qrH+A6bWbPvGQah7iGfmQ7HsbtvNDKyjoNbZs7aOz4vAdvRDuydag7twLsvMyveDv9ipM7ybbEvOFRfTs4SFI7mgBovN+IgjvnBdk625//O+03sjuVxyC7XlP2PMH9Trtr8w28bAcmPShRIby5a1C8Sf8jPTJxRbx2tFi8GN8OPZ3dOrxIdzm8XO/uPObKGbxpQw+8bo3HPIn247s3QNK70bCqPM6YnrsVSpe7jMiWPPrYX7tEQmC7FL6HPOwuNbtTYjq72uRxPFyvOLuegTu7t99NPEB0X7synGK7bGQgPBeSj7tdUZW7ZZv1O1vFpbudxce7pjH4OrwszrvWZaO7t6qlu7Mfujt5Q1G7SSSVvFmztzux+SG6QCzrvIh5qDtKGqU7/nkXvQs8iTv7zzE8LP0qvbCwCjvviYE8m8MovcUaoLq+Gp08eOcNvaN+p7sa8aY8v0S5vNftDLx2vp88nba4u/paP7yteY08DvLlPE//o7zEfEs8pB6GPefnkLxkaiE6Ffi4PXLC67uNr0O82THIPSvkXDv/naW833m8PfvfGDxSt7u82vCjPbM7LzxNEbO8xr2JPSHAFzyjZZy8FNlmPXou5DtWloK8kCBEPcL8ozvbaVi8yqgoPa8oeTsLfTq8ggkQPQHDWTsX+i+8c17sPID+VTv/pTu8PrCvPCHTWDvY3128ZatoPH5zIzt2+YW8hbpnO4yCZDtiWmK8dRIKvOvK0TxZseC7b9bYvC2NvDyEFay6h+3zvL7GXDzZzx88+hLMvI7yMjt3UqM8+iFcvFyANrwSHOk86OduO2pY37zrZhA9LDPKPFNhML2C3SE9MIRFPeFtZ72QiiY9ThyXPf0/j72+3SE97zX4PSa7w72NhQY9qhMpPsNerr1+HKo8r0U6PiBqVL2drP87PdA4Pi4Yj7zz93G7bmwvPm4VBzz6sk28JJQiPlE3uzy+bpa8UgYVPrAL5zyJUa+82IwIPrdU5Twdd7e8HWr7PZ/K0TzBRLa8CBPoPdoqvzywELO8yI7UPfozuDwKerS8Q2S9PXl8wDzDT8G8OGacPdmW1jzc7+C8Dn9iPXdN5zxBxQq98zWJPFjU+zznLPW8IFojvDzdWT1ymUO8ZCbEu4oMDz0579i7sxqyPBX0AzwlZpE7ffdiPctWbrwwFn08/1u3PXjUF719BN48D231PYBNdL3ZAB09FY0TPprUpb3kSEA93qgkPkNczr2k8VA9gv41PmYxAb7tdkY9IyNTPsjqMb6CBwI9kChgPv97C75HCdY8r/Y7Pvaphr1NW7U8/yAfPjB7UrxhFXU8ztwRPomtpjwrVtI7WmIOPn9OGT0u3Dm7ASAPPhtGND0PYzi8nnERPoc3Nz1n7o+89eoTPoeqMD2V/7G8j50VPv1uKz3Crsi8B2MVPtXOLz1Gpdy8SakRPlO7Qz0CUvi8ergFPsHRbT03axS9s8LgPX4TkT3rAEG9gmkwPVXWsz0pqTu9nNCdPd1hNzr41UW8mOQEPnXZX7y2/De84wU5PggU+rxJUZK6PJZoPiI+P73ftUg8S5SFPssLgb33m9k8FfuOPiSmor0EmCQ9j2KQPiaFxL34/U49PsCIPuEn673W3V49JESAPnLcF77N/DE9lFpfPpWOXr7+ZfA7ZxchPvej872LWpw8lLNwPQHNl7yCrtw8/2wdPVIdsTxiFc88FohlPWlXFj2O/I486DiZPdMfNz27kOk7UfK+PQPDRz0NwXG7ddfkPab3TD1AS1O8O7EEPpISTT1BrKG82LIVPtjOUD25Fcu8p8ckPlsTYj0ePO+8KqYxPuq9hj3NRw29JRo1PuDpsz1rmS295x04PoqxCT6y9G69Jg2JPXrRVj49gnu9PXD9PjNMJ7wVeqQ7p6j4Pr7hvbzrxVE8+i71PvdyA73B7aI8ZJzwPpNxKb3HnuY8+4joPst9U71oSxo9WDPbPrkff71RakE9pUnHPjG8lr2pgV09uVGpPk6ltL3UgVo9+S2EPuf18L2duu48Dtv7PUXBJL7Tdde8AAAAAAAAAAAAAAAAAAAAAAAAAAAAAAAATpBQuTwG2jt+R8E8A8bwO1MosDwN+pw8PurXPKDoAj2FHyE8IeBJPRMYHj3W3OY59deYPSTMLD3kiQa8P+PPPWuZNT3f2Xy8ipYEPtN8QT1v96+846giPsZhWj0Rsd+8P2VEPj8giT01iwy9XetqPgshvT1CEDO9kn6UPqiWFj6pZm+9y/27Pmhniz4fR5e9RUMBPwsWk7uVzUI8Dm4DP/CjELxZ1Ng8SmYDP6/uQrwEHA89168AP8ggh7wTdC094Xj2Ph9YtryOQEw9G0HlPt9k6LzveGc9P5XMPicGD71KvnQ9K0SpPgaYMb2w2V49tL96PtsCa72mYss8mUTgPTB0kb2VO+O8AAAAAAAAAAAAAAAAAAAAAAAAAAAAAAAAb0X6u14gJbqBELA8xtRBvDlO+TsnS5Q8gGwFOtp/gDx9vDE86f2lPEu8rTx6T4M7P3M5PQOxyDyW+Ta7aFGZPRZu2zy1AhO8aBHePVMo8jyrQHC8n04XPnMXDD1meam8dfJFPsjOND2hI+i8DL2HPtLIdD0lQSC9rg+mPkj5tz0/BVC9dwwNPzwZKj7GxKa9FoIBPwIp5zHI3V88eDEEPzTdNjJRXPM8RkAEPysMnDINrxw9MGMBP4fh8DI5yzk9sIf3PoFWRTM6rFY9NOflPqX2UzO1Fm89PJvMPqwbMDMitHg9qWyoPj74ITNTb149k+p2PlodKDNdr8M8+uXZPaRLDjOMN9+8AAAAAAAAAAAAAAAAAAAAAAAAAAAAAAAA3OcLvNfB3rLQ8qk8svKIvPtTb7ONSpI8SL0CvNo9XrPeVT08yYsZPKFEY7MGrbs7xREIPcd8g7P7Ve24+q+APVkFabN0wbO7pNDHPUmuF7ONXS28V18PPpcttrJ7eIS8YKJAPqIIUrJM58C8s46LPjmMIbNUUQy9aUykPvcJpLISsDW9hd8XP8XofLNKH6W9RUMBPzQWkzuTzUI8Dm4DPw+kEDxY1Ng8SWYDP+juQjwEHA89168AP/AghzwSdC094nj2PlVYtjyRQEw9GkHlPhhl6DzxeGc9PpXMPkAGDz1LvnQ9KkSpPhqYMT2v2V49sr96Pu8Caz2hYss8lETgPTd0kT2hO+O8AAAAAAAAAAAAAAAAAAAAAAAAAAAAAAAAf0X6u6cbJTp1ELA8qtRBvP9O+bshS5Q8tW8FOgaAgLxlvDE89P2lPHm8rbxZT4M7QnM5PTixyLx1+Ta7alGZPUxu27yhAhO8axHePYAo8ryYQHC8oE4XPoMXDL1feam8c/JFPtXONL2gI+i8C72HPuXIdL0hQSC9rQ+mPkz5t71GBVC9eAwNP0AZKr7LxKa9PXD9PklMJzwSeqQ7p6j4PtDhvTzpxVE8+y71PgdzAz2+7aI8ZZzwPqxxKT3FnuY8/IjoPud9Uz1qSxo9WTPbPtoffz1SakE9pUnHPkO8lj2qgV09uVGpPl2ltD3SgVo99y2EPu/18D2Iuu48DNv7PUjBJD7Wdde8AAAAAAAAAAAAAAAAAAAAAAAAAAAAAAAARJFQuY4G2rt0R8E8F8bwO2gosLz7+Zw8UerXPK3oAr1KHyE8KeBJPSAYHr2P3OY59deYPTTMLL2yiQa8QuPPPYCZNb232Xy8jpYEPut8Qb1p96+86agiPt9hWr0Usd+8Q2VEPksgib05iwy9YOtqPhQhvb1DEDO9lX6UPqqWFr68Zm+9zv27Pmlni742R5e9ntCdPaxgN7oL1kW8nOQEPqHZXzzh/De86QU5PioU+jzUUpK6RZZoPj0+Pz24tUg8UZSFPtsLgT3nm9k8HPuOPjmmoj0BmCQ9lWKQPj6FxD36/U49QsCIPvYn6z3V3V49JkSAPnncFz7J/DE9lVpfPpuOXj7/ZfA7YxchPvej8z20Wpw8brNwPfjMlzyXrtw85mwdPV8dsbxvFc88BohlPWpXFr2I/I485jiZPdkfN72HkOk7U/K+PRDDR731wHG7edfkPbf3TL0eS1O8P7EEPqQSTb02rKG84LIVPu7OUL3AFcu8s8ckPncTYr0xPO+8NqYxPvm9hr3YRw29Lxo1Purps715mS299B04PouxCb7N9G69OQ2JPXrRVr51gnu9HVojvEDdWb2rmUO8TibEu4gMD73V79i7xhqyPOnzA7yJZZE7nfdiPTFXbjzuFX08Gly3PaDUFz1qBN48Mm31PbdNdD3bAB09KI0TPrnUpT3sSEA976gkPl1czj2r8VA9j/41PnExAT72dkY9KSNTPtHqMT6QBwI9kChgPgF8Cz5dCdY8rPY7Pvephj1dW7U8/CAfPvB6Ujx4FXU8ytwRPqutprwlVtI7WGIOPo1OGb0M3Dm7AyAPPipGNL0XYzi8pHERPp03N71u7o+8/+oTPp+qML2i/7G8nJ0VPhRvK73Zrsi8FmMVPu/OL71gpdy8V6kRPm+7Q70bUvi8hrgFPtbRbb1HaxS9ysLgPXoTkb0HAUG9kGkwPUXWs71XqTu9bRIKvO7K0bytseC7edbYvDGNvLyTFqy6k+3zvLHGXLzUzx889RLMvJDxMruBUqM8oyFcvOGANjwnHOk8a+puO8pY3zz7ZhA9kDPKPI5hMD2S3SE9bIRFPRZuZz2iiiY9aByXPRJAjz3I3SE9/jX4PTO7wz2ShQY9shMpPtBerj1zHKo8t0U6Pi5qVD1/rP87QtA4PhEYjzxw+HG7dWwvPtIVB7w2s028LJQiPnc3u7zWbpa8WwYVPtEL57yeUa+84IwIPttU5bw8d7e8NWr7Pb3K0bznRLa8JBPoPfcqv7zRELO84o7UPSA0uLwherS8VmS9PZ18wLzZT8G8RWacPeuW1rz37+C8HH9iPV1N57xWxQq94jWJPBHU+7wlLfW8vaqlu7gfurvKQ1G7ViSVvH+zt7vS+iG